{
  "schema_version": "1.0.0",
  "dataset": {"name": "horizon-gig-multi-income", "seed": 1707, "scenario_date": "2026-07-27", "time_mode": "fixed", "timezone": "America/New_York", "locale": "en-US", "currency": "USD"},
  "scale": {"preset": "custom", "customers": 1, "history_days": 180},
  "archetypes": {"include": ["gig-multi-income"]},
  "modules": ["accounts", "cards", "transactions", "incomes", "budgets", "goals", "alerts", "service_interactions", "devices"],
  "overlays": ["payday", "low-balance", "job-change"],
  "outputs": {"formats": ["bundle-json", "jsonl", "csv", "sqlite", "mongo"]},
  "narrative": {"mode": "template"}
}
