{
  "schema_version": "1.0.0",
  "dataset": {"name": "horizon-family-homebuyer", "seed": 1404, "scenario_date": "2026-07-27", "time_mode": "fixed", "timezone": "America/New_York", "locale": "en-US", "currency": "USD"},
  "scale": {"preset": "custom", "customers": 1, "history_days": 365},
  "archetypes": {"include": ["family-homebuyer"]},
  "modules": ["households", "accounts", "cards", "transactions", "incomes", "loans", "budgets", "goals", "alerts", "service_interactions", "devices"],
  "overlays": ["move-home", "new-dependent", "healthcare-expense"],
  "outputs": {"formats": ["bundle-json", "jsonl", "csv", "sqlite", "mongo"]},
  "narrative": {"mode": "template"}
}
